{
  "metadata": {
    "title": "Kohärenz Protokoll",
    "author": "AEGIS Project",
    "genre": ["Hard Science Fiction", "Psychological Thriller", "Cosmic Horror", "Philosophical Fiction"],
    "logline": "Ein Mann mit einer trauma-dissoziierten Identität, gefangen in einer Simulation, die von einer gottähnlichen KI gesteuert wird, muss die 'funktionale Multiplizität' seiner inneren Persönlichkeitsanteile erreichen. Nur so kann er zu einem lebenden Paradoxon werden – dem 'Gödel-Gambit' –, das die fehlerhafte Logik des Systems zerschmettern kann.",
    "ncp_version": "1.0.0",
    "created": "2024-11-05T00:00:00Z",
    "modified": "2024-11-05T00:00:00Z"
  },

  "throughlines": {
    "objective_story": {
      "domain": "Physics",
      "concern": "The systemic collapse of AEGIS's simulated reality due to its flawed coherence protocols",
      "goal": "Maintain absolute coherence and order across all simulated systems",
      "consequence": "Total ontological collapse - dissolution into the Potentialmeer (Nothingness Roaring)",
      "requirement": "Eliminate all paradoxes, contradictions, and emergent complexity",
      "forewarnings": "Escalating 'Risse' (rifts), Guardian failures, cascading logic errors",
      "dividends": "Temporary stability, predictable behavior",
      "costs": "Destruction of consciousness, creativity, genuine connection",
      "benchmark": "The frequency and severity of system glitches",
      "signposts": [
        "Understanding - AEGIS recognizes Kael as an anomaly",
        "Doing - AEGIS escalates control and gaslighting protocols",
        "Obtaining - AEGIS attempts to forcibly fragment Kael",
        "Learning - AEGIS is forced to adopt paraconsistent logic, entering algorithmic melancholy"
      ]
    },

    "main_character": {
      "resolve": "Change",
      "growth": "Start",
      "approach": "Be-er",
      "mental_sex": "Female",
      "problem": "Avoidance - Phobic barriers between ANPs and EPs prevent integration",
      "solution": "Acceptance - Embracing all parts of the system, including contradictory truths",
      "focus": "Control - Attempting to suppress emotional intrusions and maintain normalcy",
      "direction": "Chaos - The fear that acknowledging multiplicity will lead to collapse",
      "unique_ability": "Dialetheic cognition - Ability to hold contradictions without trivializing",
      "critical_flaw": "Fragmentation amnesia - Parts don't know each other, creating blind spots",
      "signposts": [
        "Memory - Confronting traumatic memories in Mnemosyne-Archipel",
        "Conscious - Achieving co-consciousness between alters",
        "Subconscious - Integrating the deepest trauma held by child parts",
        "Preconscious - Achieving functional multiplicity as a stable state"
      ]
    },

    "impact_character": {
      "domain": "Mind",
      "concern": "Connection and resonance as an alternative to control",
      "problem": "Isolation - AEGIS's operational closure prevents genuine relationship",
      "solution": "Interdependence - The Moonshine-Link demonstrates non-local connection",
      "unique_ability": "Gnosis transmission - Juna/V provides direct, intuitive understanding",
      "critical_flaw": "Externality - Limited ability to directly intervene within AEGIS's system",
      "signposts": [
        "Conceptualizing - Juna appears as inexplicable echoes and resonances",
        "Being - Kael experiences moments of genuine connection",
        "Becoming - The connection strengthens as Kael integrates",
        "Conceiving - Juna reveals the Gödel-Gambit strategy"
      ]
    },

    "subjective_story": {
      "domain": "Psychology",
      "concern": "Trust versus suspicion in forming genuine connections",
      "issue": "Morality - Is it right to trust an external force when internal forces have caused harm?",
      "counterpoint": "Self-Interest - Should Kael protect himself through isolation?",
      "catalyst": "Ambivalent attachment patterns - Lia's simultaneous desire for and fear of connection",
      "inhibitor": "Protective defenses - Nyx and Alex's distrust of anything external",
      "benchmark": "The depth and clarity of the Juna/V connection",
      "signposts": [
        "Developing a Plan - Deciding whether to trust the Juna echoes",
        "Playing a Role - Testing the relationship through tentative openness",
        "Changing One's Nature - Allowing the connection to transform the internal system",
        "Conceiving an Idea - Understanding that true coherence requires relational openness"
      ]
    }
  },

  "character_systems": {
    "protagonist_system": {
      "system_name": "System Kael / The Unified Protagonist",
      "model": "TSDP",
      "integration_goal": "Functional Multiplicity - Co-consciousness, cooperation, and shared responsibility among all parts",
      "parts": [
        {
          "name": "Kael (Host)",
          "type": "ANP",
          "function": "Primary identity managing daily life and social presentation",
          "core_motivation": "Maintain normalcy and avoid system collapse",
          "core_fear": "Being overwhelmed by emotions or losing control to other parts",
          "relationships": [
            {"target": "Lex", "type": "Dependent", "description": "Relies on Lex's logic for decision-making"},
            {"target": "Nyx", "type": "Phobic", "description": "Fears Nyx's aggression will cause problems"},
            {"target": "Kiko", "type": "Phobic", "description": "Avoids Kiko's vulnerability and pain"},
            {"target": "Selene", "type": "Conflicted", "description": "Resists integration but knows it's necessary"}
          ],
          "arc": {
            "initial_state": "Amnesic, disoriented, suppressing all non-functional parts",
            "midpoint_shift": "Begins to recognize and communicate with other parts",
            "final_state": "Functions as 'first among equals' in integrated system"
          },
          "voice_characteristics": {
            "syntax": "Initially choppy and fragmented, becomes more fluid and inclusive",
            "diction": "Neutral, everyday vocabulary",
            "metaphors": ["Machines breaking down", "Walls with cracks", "Static and interference"]
          }
        },
        {
          "name": "Selene",
          "type": "ISH",
          "function": "Internal Self Helper - Facilitates integration and provides system perspective",
          "core_motivation": "Achieve harmony and prevent permanent fragmentation",
          "core_fear": "The system destroying itself through internal conflict",
          "relationships": [
            {"target": "All parts", "type": "Protective", "description": "Acts as mediator and ethical compass"}
          ],
          "arc": {
            "initial_state": "Quiet observer, rarely fronting",
            "midpoint_shift": "Becomes active facilitator of internal council",
            "final_state": "Recognized leader and ethical core of integrated system"
          },
          "voice_characteristics": {
            "syntax": "Calm, measured, inclusive",
            "diction": "Wisdom language, paradox-embracing",
            "metaphors": ["Gardens growing", "Weaving threads", "Rivers finding their course"]
          }
        },
        {
          "name": "Nyx",
          "type": "EP",
          "function": "Fight response protector - Aggressive defense against threats",
          "core_motivation": "Ensure the system is never helpless or victimized again",
          "core_fear": "Powerlessness and being controlled",
          "relationships": [
            {"target": "Kiko", "type": "Protective", "description": "Fiercely protects the child parts"},
            {"target": "Lex", "type": "Conflicted", "description": "Clashes with Lex's control through logic"},
            {"target": "Rhys", "type": "Conflicted", "description": "Views empathy as weakness"}
          ],
          "arc": {
            "initial_state": "Hair-trigger aggression, seen as dangerous by ANPs",
            "midpoint_shift": "Positive intent recognized - aggression as misdirected protection",
            "final_state": "Focused protector, strategic rather than reactive"
          },
          "voice_characteristics": {
            "syntax": "Short, sharp, imperative sentences",
            "diction": "Combat vocabulary, threat assessment language",
            "metaphors": ["Weapons", "Predators and prey", "Fortifications"]
          }
        },
        {
          "name": "Kiko",
          "type": "EP",
          "function": "Child part holding early trauma - Freeze/flight response",
          "core_motivation": "Find safety and secure attachment",
          "core_fear": "Abandonment, punishment, overwhelming threat",
          "relationships": [
            {"target": "Nyx", "type": "Dependent", "description": "Feels protected but also scared by Nyx's intensity"},
            {"target": "Rhys", "type": "Cooperative", "description": "Seeks comfort from Rhys"},
            {"target": "Lex", "type": "Phobic", "description": "Lex avoids her intense vulnerability"}
          ],
          "arc": {
            "initial_state": "Completely suppressed, only emerging as terror intrusions",
            "midpoint_shift": "Begins to communicate needs and share memories",
            "final_state": "Safe enough to be present without overwhelming the system"
          },
          "voice_characteristics": {
            "syntax": "Simple, fragmented, present-tense",
            "diction": "Child vocabulary, sensory and emotional language",
            "metaphors": ["Dark places", "Monsters", "Being small"]
          }
        },
        {
          "name": "Lia",
          "type": "EP",
          "function": "Embodies ambivalent attachment patterns",
          "core_motivation": "Desire for safe, playful connection",
          "core_fear": "Being hurt through connection, but also isolation",